{
  "schemaVersion": "1.0",
  "metadata": {
    "id": "beginner-scratch-17",
    "title": "Platformer Mini",
    "description": "Buat game platformer mini — karakter bisa lari ke kiri-kanan dengan tombol arah dan melompat melewati platform, seperti Mario versi Scratch!",
    "level": "beginner",
    "category": "Scratch",
    "topicNumber": 17,
    "estimatedTime": 40,
    "xp": 100
  },
  "introduction": {
    "title": "Buat Game Platformer Seperti Mario — Di Scratch!",
    "description": "Platformer adalah genre game paling ikonik sepanjang masa — Mario, Sonic, Kirby, semuanya platformer! Di lesson ini, kita bikin versi mini-nya di Scratch: karakter bisa berlari ke kiri-kanan, melompat, dan ada gravitasi yang menarik karakter ke bawah. Ini salah satu mekanik paling menantang tapi juga paling memuaskan untuk dibuat — dan kamu akan bisa melakukannya!",
    "analogy": "Gravitasi di dunia nyata selalu menarik kamu ke bawah dengan kecepatan yang terus bertambah (akselerasi). Di Scratch, kita simulasikan ini dengan variabel 'Kecepatan Y' yang terus dikurangi setiap frame. Saat lompat, kita beri Kecepatan Y positif besar — lalu gravitasi terus mengecilkannya sampai karakter jatuh kembali!"
  },
  "objectives": [
    "Memahami konsep gravitasi sebagai variabel kecepatan Y yang berubah",
    "Mengimplementasikan mekanik lompat yang hanya bisa dilakukan dari lantai",
    "Menggunakan deteksi warna untuk mendeteksi platform/lantai",
    "Membuat gerakan kiri-kanan dengan animasi kostum berjalan",
    "Menggabungkan semua mekanik menjadi platformer yang bisa dimainkan"
  ],
  "review": {
    "learned": [
      "Gravitasi di Scratch disimulasikan dengan variabel KV (kecepatan vertikal) yang berkurang setiap frame.",
      "Lompatan dilakukan dengan mengatur KV ke nilai positif besar (misalnya 12) saat di lantai.",
      "Blok 'menyentuh warna [hijau]?' mendeteksi apakah karakter di atas platform/lantai.",
      "Karakter hanya bisa lompat saat di lantai — mencegah lompat di udara (double jump).",
      "Gerakan horizontal dan vertikal dikelola secara terpisah tapi dalam loop yang sama."
    ],
    "keyConcepts": [
      "Simulasi gravitasi dengan variabel KV",
      "Mekanik lompat: set velocity Y",
      "Platform detection: menyentuh warna",
      "Cegah double jump: cek di lantai dulu",
      "Horizontal + vertikal movement"
    ],
    "takeaways": [
      "Gravitasi adalah pengurangan konstan pada kecepatan vertikal — ini prinsip fisika nyata!",
      "Variabel kecepatan (velocity) adalah cara paling alami untuk mengimplementasikan gerakan fisika.",
      "Deteksi lantai dengan warna adalah metode paling mudah untuk platformer di Scratch."
    ]
  },
  "learningPath": [
    {
      "id": "node-01-preview",
      "type": "lesson",
      "title": "Ini yang Akan Kamu Buat!",
      "xp": 5,
      "explanation": "Di akhir lesson ini, kamu akan punya game platformer mini:\n• Karakter bisa lari ke kiri dan kanan dengan tombol panah\n• Tekan SPASI untuk lompat — karakter melengkung naik lalu jatuh kembali\n• Ada gravitasi — karakter selalu jatuh jika tidak di platform\n• Ada platform yang bisa dipijak (warna hijau di backdrop)\n• Jatuh dari platform? Karakter reset ke posisi awal\n• Animasi berlari (ganti kostum saat bergerak)\n\nSetelah ini, kamu bisa tambahkan koin, musuh, dan level — ini adalah fondasi game platformer sungguhan!",
      "tips": [
        "Gambar backdrop platform dengan platform berwarna hijau solid — lebih mudah dideteksi sensor warna.",
        "Mulai dengan platform yang lebar agar lebih mudah diuji sebelum membuat platform yang susah."
      ]
    },
    {
      "id": "node-02-gravity-concept",
      "type": "lesson",
      "title": "Simulasi Gravitasi — Fisika dalam Coding",
      "xp": 5,
      "explanation": "Gravitasi di dunia nyata mempercepat benda jatuh — makin lama jatuh, makin cepat. Di Scratch, kita simulasikan ini dengan variabel 'KV' (Kecepatan Vertikal):\n\nSetiap frame:\n• KV = KV - 1 (gravitasi mengecilkan kecepatan vertikal)\n• Y = Y + KV (posisi bergerak sesuai kecepatan)\n\nSaat lompat:\n• KV = 12 (dorong ke atas kencang!)\n• Lalu setiap frame, KV berkurang 1\n• KV = 12, 11, 10, 9... 1, 0, -1, -2... -10 (jatuh kembali)\n\nSaat di lantai:\n• KV tidak boleh kurang dari 0 (tidak bisa menembus lantai)\n• Deteksi lantai: 'jika menyentuh warna hijau, stop jatuh'",
      "analogy": "Bayangkan melempar bola ke atas. Awalnya bola naik cepat, lalu melambat, lalu berhenti di puncak, lalu mulai jatuh semakin cepat. Variabel KV yang terus berkurang 1 setiap frame persis seperti itu — dari 12 turun ke 0 (puncak) terus ke -12 (jatuh cepat)!",
      "tips": [
        "Nilai gravitasi (-1 per frame) bisa diubah: -0.5 = gravitasi lebih ringan (lompat lebih tinggi), -2 = gravitasi lebih berat (lompat lebih pendek).",
        "Nilai lompat (12) bisa diubah: 8 = lompat rendah, 15 = lompat sangat tinggi."
      ]
    },
    {
      "id": "node-03-gravity-code",
      "type": "code",
      "title": "Implementasi Gravitasi",
      "xp": 5,
      "explanation": "Pertama, kita buat variabel 'KV' (Kecepatan Vertikal). Variabel ini diupdate setiap frame di dalam loop utama.\n\nDeteksi lantai menggunakan warna platform hijau di backdrop. Saat menyentuh platform, KV tidak boleh negatif (tidak bisa menembus platform).",
      "code": {
        "language": "scratch",
        "content": "[ketika bendera hijau diklik]\n[atur [KV ▼] ke [0]]\n[pergi ke x: [-150] y: [50]]\n[ulangi terus]\n  // Gravitasi: kurangi KV setiap frame\n  [ubah [KV ▼] sebesar [-1]]\n  // Terapkan KV ke posisi Y\n  [ubah y sebesar (KV)]\n  // Deteksi lantai (warna hijau di backdrop)\n  jika <menyentuh warna [#00AA00]?> maka\n    // Dorong ke atas sampai tidak menyentuh platform\n    [ubah y sebesar [2]]\n    // Hentikan kecepatan ke bawah\n    jika <(KV) < [0]> maka\n      [atur [KV ▼] ke [0]]\n    [akhir jika]\n  [akhir jika]\n[akhir ulangi]"
      }
    },
    {
      "id": "node-04-jump-walk",
      "type": "code",
      "title": "Lompat dan Berlari",
      "xp": 5,
      "explanation": "Tambahkan kontrol horizontal dan lompatan. Lompat hanya bisa dilakukan saat di lantai (KV = 0 atau mendeteksi platform) agar tidak bisa lompat di udara.\n\nAnimasi berjalan dengan mengganti kostum hanya saat karakter bergerak.",
      "code": {
        "language": "scratch",
        "content": "// Tambahkan di dalam loop utama, sebelum gravitasi:\n\n// Gerakan horizontal\njika <tombol [panah kanan ▼] ditekan?> maka\n  [ubah x sebesar [4]]\n  [atur gaya rotasi ke [kiri-kanan ▼]]\n  [hadap arah [90 ▼]]\n  [kostum berikutnya]\n[akhir jika]\njika <tombol [panah kiri ▼] ditekan?> maka\n  [ubah x sebesar [-4]]\n  [atur gaya rotasi ke [kiri-kanan ▼]]\n  [hadap arah [-90 ▼]]\n  [kostum berikutnya]\n[akhir jika]\n\n// Lompat — hanya dari lantai!\njika <<tombol [spasi ▼] ditekan?> dan <(KV) = [0]>> maka\n  [atur [KV ▼] ke [12]]\n  [putar suara [pop ▼]]\n[akhir jika]"
      }
    },
    {
      "id": "node-05-platforms",
      "type": "code",
      "title": "Platform dan Reset Jatuh",
      "xp": 5,
      "explanation": "Tambahkan pengecekan apakah karakter jatuh terlalu jauh (keluar dari bawah layar). Jika iya, reset ke posisi awal.\n\nJuga tambahkan batas horizontal agar karakter tidak keluar dari tepi layar.",
      "code": {
        "language": "scratch",
        "content": "// Tambahkan di akhir loop, setelah gravitasi:\n\n// Jatuh keluar layar → reset\njika <(posisi y) < [-185]> maka\n  [putar suara [Oops ▼]]\n  [pergi ke x: [-150] y: [50]]\n  [atur [KV ▼] ke [0]]\n[akhir jika]\n\n// Batas kiri-kanan\njika <(posisi x) > [230]> maka\n  [atur x ke [230]]\n[akhir jika]\njika <(posisi x) < [-230]> maka\n  [atur x ke [-230]]\n[akhir jika]"
      }
    },
    {
      "id": "node-06-complete",
      "type": "code",
      "title": "Platformer Lengkap — Semua Mekanik!",
      "xp": 5,
      "explanation": "Ini adalah kode platformer lengkap yang mengombinasikan semua mekanik. Pastikan backdrop sudah memiliki platform berwarna hijau (#00AA00) yang bisa dipijak.\n\nBackdrop dibuat di tab 'Latar Belakang' → Paint → gambar kotak-kotak hijau sebagai platform dan lantai.",
      "code": {
        "language": "scratch",
        "content": "[ketika bendera hijau diklik]\n[atur [KV ▼] ke [0]]\n[pergi ke x: [-150] y: [50]]\n[atur ukuran ke [50] %]\n\n[ulangi terus]\n  // === KONTROL HORIZONTAL ===\n  jika <tombol [panah kanan ▼] ditekan?> maka\n    [ubah x sebesar [4]]\n    [hadap arah [90 ▼]]\n    [kostum berikutnya]\n  [akhir jika]\n  jika <tombol [panah kiri ▼] ditekan?> maka\n    [ubah x sebesar [-4]]\n    [hadap arah [-90 ▼]]\n    [kostum berikutnya]\n  [akhir jika]\n\n  // === LOMPAT ===\n  jika <<tombol [spasi ▼] ditekan?> dan <(KV) = [0]>> maka\n    [atur [KV ▼] ke [12]]\n    [putar suara [pop ▼]]\n  [akhir jika]\n\n  // === GRAVITASI ===\n  [ubah [KV ▼] sebesar [-1]]\n  [ubah y sebesar (KV)]\n\n  // === DETEKSI PLATFORM ===\n  jika <menyentuh warna [#00AA00]?> maka\n    [ubah y sebesar [2]]\n    jika <(KV) < [0]> maka\n      [atur [KV ▼] ke [0]]\n    [akhir jika]\n  [akhir jika]\n\n  // === JATUH DAN RESET ===\n  jika <(posisi y) < [-185]> maka\n    [pergi ke x: [-150] y: [50]]\n    [atur [KV ▼] ke [0]]\n  [akhir jika]\n[akhir ulangi]"
      }
    },
    {
      "id": "node-07-tips",
      "type": "lesson",
      "title": "Tips & Variasi — Dari Mini ke Full Game!",
      "xp": 5,